{
  "schema_version": "visual-audit.v1",
  "paper_id": "icml-2026-1ef10519dcd7",
  "source_acquisition": {
    "status": "repository_without_visual_source",
    "repository_candidates": [
      "https://github.com/chewisinho/chewisinho.github.io",
      "https://github.com/hetankevin/diffusion-fors",
      "https://github.com/will-rice/icml-2026-reproductions"
    ],
    "selected_repository": "https://github.com/hetankevin/diffusion-fors",
    "visual_source_files": [],
    "search_note": "PDF 可提取文本只出现参考文献中的作者主页 https://chewisinho.github.io/；本地 reading 元数据另给出 arXiv PDF https://arxiv.org/pdf/2602.01338 和 OpenReview https://openreview.net/forum?id=GW3umRqsZZ，均未提供本文 Figure/Table 源文件。只读 gh 检索完整标题的 repository 返回空数组；作者主页精确标题条目只列 arXiv、ICML 和 .bib，tree 没有本文 .tex、plot/figure/table/visual 源。arXiv ID 检索到 hetankevin/diffusion-fors，其 README/tree 的 fors_driver.ipynb、fors_driver_final_only.ipynb、figs/celeba_results.png、matplotlibrc 和 CSV 属于独立 CelebA DDPM/DDIM/FORS benchmark，不对应本 PDF 的任何 Figure/Table；完整标题路径命中的 will-rice/icml-2026-reproductions 只有 reproduction code/evidence/tests，也没有 plot*、figure*、visual*、table*、.tex、.tikz、.pgf、.svg、.ipynb 或 style 文件。没有可对应本 PDF 对象的公开绘图、表格或 LaTeX 源，因此不记录 sourceFile。"
  },
  "paper_style": {
    "main_figures": 0,
    "main_tables": 0,
    "appendix_figures": 0,
    "appendix_tables": 0,
    "dominant_figure_typography": {
      "family": [],
      "size_pt": {
        "minimum": null,
        "median": null,
        "maximum": null
      },
      "weight": [],
      "style": [],
      "provenance": "pdf_object",
      "confidence": "low"
    },
    "dominant_table_typography": {
      "family": [],
      "body_size_pt": null,
      "header_size_pt": null,
      "header_weight": "regular",
      "provenance": "pdf_object",
      "confidence": "low"
    },
    "palette_strategy": "PDF 没有 Figure/Table 数据调色板。黑色用于正文、公式、算法框和规则线，蓝色用于引用/超链接；颜色不编码系列、类别、结果方向或不确定性。",
    "vector_raster_mix": "200 dpi 页面渲染为 1700 × 2200 PNG；pdfimages -list 无 image XObject 行。原 PDF 的正文、公式、定理块、规则线和三段算法框由文本/矢量对象组成；PNG 是审计渲染产物，不是嵌入图像。",
    "style_consistency": "正文、Acknowledgments、References 与 Appendix A–G 均保持单栏 letter 版式，section heading、theorem-like hierarchy、公式编号和页脚稳定。p. 6、p. 8、p. 12 的算法框共享横线和黑色数学/serif ink；没有 Figure/Table，无法建立图表字号、legend、表头或色板的一致性比较。"
  },
  "figures": [],
  "tables": [],
  "cross_object_system": {
    "visual_narrative": "不存在 Figure/Table 叙事。论文以 DDPM background → Gaussian tilt → FORS（Algorithm 1）→ backward diffusion（Algorithm 2）→ log-concave/proximal sampler（Algorithm 3）的公式、定理和算法链推进主张，Appendix C–G 承担证明。",
    "caption_system": "p. 1–43 未出现 Figure、Fig.、Table 或 Tab. caption。Algorithm 1–3 有算法标题及 Input/Output 行，但这些是算法接口，不构成 Figure/Table caption。",
    "table_header_system": "不存在表格或表头。算法的 Input、循环体和 Output 是控制流字段；Theorem/Proposition 条件、bullet 结果和多行公式不构成表头/表体。",
    "method_result_ablation_link": "没有实验 Figure/Table 或 ablation 对象。FORS 和两个外层算法表达方法接口，Theorem 3.1/3.3/4.3/4.9/G.1 与 Appendix proofs 表达理论结果；Conclusion p. 12 将 implementation 和 experimental evaluation 留待 future work。",
    "main_appendix_link": "主文 p. 5–12 通过 Theorem、Algorithm 和公式调用 Appendix C–G 的证明；附录扩展公式、tail bound 和条件，没有追加图表或主文图表的完整表格。",
    "typography_consistency": "没有 Figure/Table 对象可比较；正文、公式和算法在单栏页面内保持 serif/math/algorithm 层级。",
    "color_consistency": "没有图表语义颜色。蓝色引用/超链接在正文和附录重复出现，但不承担数据变量映射。"
  },
  "final_judgment": {
    "most_reusable_patterns": [
      "理论论文保持单栏、编号公式、定理块和算法框的可追溯阅读流，不加入与证据无关的装饰性图表。",
      "用 Algorithm 1–3 暴露方法接口，再用 Theorem 与 Appendix proof 承担复杂度和误差链；算法框与数学公式使用统一的黑色 ink。",
      "主文给出问题、算法和 headline theorem，附录连续承载 technical lemma/proof；公式编号替代图表索引。"
    ],
    "highest_value_objects": [
      "无 Figure/Table 对象：PDF 实际包含 0 Figure、0 Table、3 Algorithm，Algorithm 按协议不计为 Table；p. 6、p. 8、p. 12 的算法框是最有信息价值的视觉替代物，但不属于本 schema 的 Figure/Table。"
    ],
    "failure_patterns": [
      "没有 Figure/Table，读者无法从图表快速获得 diffusion reverse chain、FORS correction 或复杂度比较的结构总览，信息主要分布在连续公式、定理和算法文字中。",
      "p. 16–43 的附录证明公式密度高；低分辨率截图或纯文本抽取容易把公式对齐、boxed math 和算法规则误判成表格。",
      "没有 empirical result table、failure panel 或 ablation figure；论文在 p. 12 将 implementation 和 experimental evaluation 标为 future work，经验比较不在该 PDF 的视觉系统内。"
    ],
    "one_sentence_visual_strategy": "论文采用单栏、黑色 serif/math 排版，以三段算法框、编号公式和 theorem-driven Appendix 组织理论叙事，Figure/Table 从未进入该 PDF 的视觉策略。"
  }
}
